{
  "$schema": "https://json-schema.org/draft/2020-12/schema",
  "$id": "urn:media-trace:dataset:D04:annotation:0.1.0",
  "type": "object",
  "properties": {
    "sample_id": {
      "type": "string",
      "format": "uuid"
    },
    "dataset_id": {
      "const": "D04"
    },
    "asset_ids": {
      "type": "array",
      "items": {
        "type": "string",
        "format": "uuid"
      },
      "minItems": 1,
      "uniqueItems": true
    },
    "source_group_ids": {
      "type": "array",
      "items": {
        "type": "string",
        "minLength": 1,
        "maxLength": 128
      },
      "minItems": 1,
      "uniqueItems": true
    },
    "source_authorization_ref": {
      "type": "string",
      "minLength": 1,
      "maxLength": 128
    },
    "annotation_version": {
      "type": "string",
      "minLength": 1,
      "maxLength": 128
    },
    "annotation_status": {
      "type": "string",
      "enum": [
        "draft",
        "reviewed",
        "disputed",
        "unknown"
      ]
    },
    "reviewer_refs": {
      "type": "array",
      "items": {
        "type": "string",
        "minLength": 1,
        "maxLength": 128
      },
      "minItems": 0,
      "uniqueItems": true
    },
    "quality_tags": {
      "type": "array",
      "items": {
        "type": "string",
        "minLength": 1,
        "maxLength": 128
      },
      "minItems": 0,
      "uniqueItems": true
    },
    "payload": {
      "type": "object",
      "properties": {
        "events": {
          "type": "array",
          "items": {
            "type": "object",
            "properties": {
              "label": {
                "type": "string",
                "minLength": 1,
                "maxLength": 128
              },
              "time_range": {
                "anyOf": [
                  {
                    "$ref": "urn:media-trace:api:0.1.0#/$defs/TimeRange"
                  },
                  {
                    "type": "null"
                  }
                ]
              },
              "bbox": {
                "anyOf": [
                  {
                    "$ref": "urn:media-trace:api:0.1.0#/$defs/BoundingBox"
                  },
                  {
                    "type": "null"
                  }
                ]
              },
              "mask_ref": {
                "anyOf": [
                  {
                    "$ref": "urn:media-trace:api:0.1.0#/$defs/ObjectRef"
                  },
                  {
                    "type": "null"
                  }
                ]
              }
            },
            "required": [
              "label",
              "time_range",
              "bbox",
              "mask_ref"
            ],
            "additionalProperties": false
          },
          "minItems": 0
        },
        "duration_ms": {
          "type": "integer",
          "minimum": 1
        },
        "is_original_audio": {
          "anyOf": [
            {
              "type": "boolean"
            },
            {
              "type": "null"
            }
          ]
        },
        "snr_level": {
          "anyOf": [
            {
              "type": "string",
              "minLength": 1,
              "maxLength": 128
            },
            {
              "type": "null"
            }
          ]
        }
      },
      "required": [
        "events",
        "duration_ms",
        "is_original_audio",
        "snr_level"
      ],
      "additionalProperties": false
    }
  },
  "required": [
    "sample_id",
    "dataset_id",
    "asset_ids",
    "source_group_ids",
    "source_authorization_ref",
    "annotation_version",
    "annotation_status",
    "reviewer_refs",
    "quality_tags",
    "payload"
  ],
  "additionalProperties": false,
  "allOf": [
    {
      "if": {
        "properties": {
          "annotation_status": {
            "const": "reviewed"
          }
        }
      },
      "then": {
        "properties": {
          "reviewer_refs": {
            "minItems": 1
          }
        }
      }
    }
  ]
}
