{
  "sample_id": "24566230-f70c-59f7-8506-d0d87ff648bd",
  "dataset_id": "D04",
  "asset_ids": [
    "0349edb8-c0aa-5f43-8dfd-1c0828fdd446"
  ],
  "source_group_ids": [
    "synthetic-v1"
  ],
  "source_authorization_ref": "synthetic-fixture-only-not-business-authority",
  "annotation_version": "synthetic-v1",
  "annotation_status": "reviewed",
  "reviewer_refs": [
    "synthetic-v1"
  ],
  "quality_tags": [],
  "payload": {
    "events": [
      {
        "label": "synthetic-v1",
        "time_range": {
          "start_ms": 0,
          "end_ms": 1000
        },
        "bbox": {
          "x": 0.1,
          "y": 0.1,
          "width": 0.4,
          "height": 0.4
        },
        "mask_ref": {
          "object_id": "92fc7f24-e025-5d58-a7a3-633f7947d7db",
          "version_id": "synthetic-v1",
          "sha256": "0000000000000000000000000000000000000000000000000000000000000000"
        }
      }
    ],
    "duration_ms": 1000,
    "is_original_audio": true,
    "snr_level": "synthetic-v1"
  }
}
